{
  "project_name": "示例项目-单屏双列",
  "project_code": "DEMO-MCGS-2COL-001",
  "protocol_title": "动环通讯协议-单屏双列",
  "generation_basis": "max_column",
  "export_family": "classic_combined",
  "communication": {
    "protocol": "Modbus RTU",
    "baud_rate": 9600,
    "parity": "N",
    "data_bits": 8,
    "stop_bits": 1,
    "default_screen_address": 1
  },
  "topology": {
    "screen_topology_mode": "single_screen_two_columns",
    "route_mode": "AB_dual_route",
    "upload_port_profile": "A3B3",
    "canonical_column_id": "J01",
    "columns_per_screen": 2,
    "screen_count": 1,
    "screen_route_binding": "both_routes_in_one_screen"
  },
  "devices": {
    "start_boxes": {
      "A": {
        "count": 1,
        "instance_names": [
          "S1"
        ]
      },
      "B": {
        "count": 1,
        "instance_names": [
          "S2"
        ]
      }
    },
    "plug_boxes": {
      "A": {
        "board_number_start": 101,
        "sequence": [
          {
            "type_code": "3P*1",
            "count": 2,
            "layout_pattern": "1"
          }
        ]
      },
      "B": {
        "board_number_start": 201,
        "sequence": [
          {
            "type_code": "3P*1",
            "count": 2,
            "layout_pattern": "1"
          }
        ]
      }
    },
    "repeater_units": {
      "enabled": false,
      "A_count": 0,
      "B_count": 0
    },
    "single_cabinet_aggregation": {
      "enabled": false,
      "cabinet_count": 0
    }
  },
  "profiles": {
    "address_profile_id": "classic_main1000_alarm6000_16bit",
    "device_library_id": "device-library-v2-board-seed",
    "export_profile_id": "classic_combined_two_columns_default",
    "start_box_template_id": "start_box_compact_31row_inlet_temp",
    "plug_branch_template_id": "plug_branch_compact_21row"
  }
}
